post_title,post_content,movie_link_1,movie_content_1,movie_link_2,movie_content_2,movie_link_3,movie_content_3,movie_link_4,movie_content_4,user_id
ギター・ベース おすすめ動画紹介,自分が役にたった動画です。みなさんも是非見てください！#ベース,https://youtu.be/FdwhIDlvd6M,音の鳴りに直結すると言われているラッカー塗装については非常に勉強になる動画です。,https://youtu.be/PbC1JCdtzzY,ベーシストなら気になるフィンガーランプを解説してくれています！,https://youtu.be/2JNWF32f4jA,名機スティングレイの解説動画です。わかりやすく説明されています。,https://www.youtube.com/watch?v=sbPdkGQzXds,機材紹介、音作り非常に参考になります。,1
ベーシストYouTuberぴんはげ 名演4選,トップベーシストYouTueberぴんはげさんの演奏動画で特に頭に残っている動画を４つ選んでみました。ご覧ください！ #ベース #弾いてみた,https://www.youtube.com/watch?v=jHAg8OPOzfk,ハーモニクスの使い方が上手いです。,https://www.youtube.com/watch?v=iyPf7qWABTQ,夜に駆けるのソロベースアレンジ。ソロのところが、気持ちいいです。,https://youtu.be/W9Rtd2UnRnY,音選びのセンスが光っています。景色が浮かび上がります。,https://www.youtube.com/watch?v=31XBna0mm5M,それぞれのベースの使い方が上手い。参考になります。,1
ベース弾いてみた ベスト4,特に上手いと思った弾いて動画を選びました！ #ベース,https://youtu.be/sCXsjwA7_Yk,音の歪具合が最高にカッコいい。音も太くて良い！,https://www.youtube.com/watch?v=ZYuYi6yHYh8,演奏が丁寧&グルーヴが気持ちいい。,https://www.youtube.com/watch?v=PF660tQlVq8,単純にカッコいい。惚れました。。,https://www.youtube.com/watch?v=gpUJoVCFumo,イントロのスラップが上手過ぎる。音作りもカッコいい。,1
羊文学 入門,私が今注目しているバンド羊文学を紹介します！ #バンド #羊文学,https://youtu.be/p6uYq0_4ct8,"先ずは、このライブを見るべし！
ライブならではの臨場感と繊細さを感じられます。",https://www.youtube.com/watch?v=2v8iq3tI0gM,"上のライブにもあった""1999""のMV。1999年にタイムスリップしたような感覚になります。",https://www.youtube.com/watch?v=16jL0eThQmM,歌詞と映像の美しさをMVで表現しています。,https://www.youtube.com/watch?v=0_6ZiXlKUeg&t=965s,藝大でのライブ。音の響き方が特徴的で、拡がっていく感じがあります！,4
2020年心が震えたスポーツ名場面4選,個人的に心が震えたスポーツ名場面を4つ選びました！是非、みなさんも見て下さい！ #2020年スポーツ名場面,https://www.youtube.com/watch?v=osxRYKeoWTo,洗練された堀口恭司のカーフキックとリベンジ成功と悔しがる朝倉海は見応えありです！,https://www.youtube.com/watch?v=XxxlkINbMls,コロナ渦での羽生結弦が魅せてくれた演技は感動ものでした！,https://www.youtube.com/watch?v=EyEKsLI4ZEQ&t=2s,パリーグ新人王の平とホームラン王の浅村との力と力のガチンコ勝負は痺れます！,https://www.youtube.com/watch?v=tw-G2nMnM8A,サムベネットのシャンゼリゼでの最終スプリントは印象に残りました。,3
面白かったアニメ系動画,個人的に面白かった動画です笑 #アニメ,https://www.youtube.com/watch?v=W3lGQyLM14Y,はなげさんのチャンネルでのアニソン総選挙！テレビでの総選挙とは違う結果に？？,https://youtu.be/RAsLKOILmh0,単純に笑いました！,https://youtu.be/c-4PiND5sQU,この動画を見て、次のアニメ何見るのか考えてもよいかもしれません笑,https://youtu.be/XkEXk6eosRI,懐かしのアニメも出てきて、とても面白い動画です！,2